{
  "automaticPromotion": false,
  "bundle": "xxx.xxx.xxx",
  "caseId": "purchase-data-caseperf-reference-v1",
  "command": [
    "/home/huawei/commandline-tools-26.0.0.821/sdk/default/openharmony/toolchains/hdc",
    "-t",
    "127.0.0.1:10100",
    "shell",
    "aa",
    "test",
    "-b",
    "xxx.xxx.xxx",
    "-m",
    "entry_test",
    "-s",
    "unittest",
    "OpenHarmonyTestRunner",
    "-s",
    "timeout",
    "120000"
  ],
  "finishedAt": "2026-09-27T01:54:00.866653+00:00",
  "framework": "instrument-test-ohosTest-hypium",
  "hdc": {
    "byteLength": 6430848,
    "path": "/home/huawei/commandline-tools-26.0.0.821/sdk/default/openharmony/toolchains/hdc",
    "sha256": "90c2554a44855a3c541c24bad5cffd46badb7eb7323c5464f6c0fb7160bdf5d0"
  },
  "logs": [
    {
      "byteLength": 327,
      "path": "logs/01.json",
      "sha256": "c3b49e01e721821003aa4f2a44116e4c0c0c6de4eab509a309cac5a38d4e32bc"
    },
    {
      "byteLength": 5511,
      "path": "logs/02.json",
      "sha256": "0cd34902788eec0b47bde36f4de80585a6c255d06e31ddba7f05e8bd68c0577e"
    }
  ],
  "module": "entry_test",
  "packages": {
    "app": {
      "byteLength": 447093,
      "path": "entry-default-unsigned.hap",
      "sha256": "043a96090d8565e4c8216363075946040ab0c35eae95db3f99850b4a81eb2822"
    },
    "test": {
      "byteLength": 1192904,
      "path": "entry-ohosTest-unsigned.hap",
      "sha256": "8122aa26777479ac6b3bc4128043c522def738e281c05cd1cd8daf899a6dd6d3"
    }
  },
  "packagesInstalled": false,
  "passed": true,
  "projectTreeSha256": "68a5d102dd5dd139333f3e40ddea1f95e4af11f966923935c49619d0fc76beff",
  "report": {
    "byteLength": 568,
    "path": "native-report.json",
    "sha256": "851f11fbbe4a71a2d741535aba9b47aea84bea1d960838b06293cecc13495b0d"
  },
  "runner": "OpenHarmonyTestRunner",
  "schema": "agentlab.harmony_standard_test_execution_receipt.v1",
  "sourceSetSha256": "cbc01c94755f2d8da5449902ad1a309488d0a9defa9fede23318ad360dd4c2c2",
  "startedAt": "2026-09-27T01:53:59.771615+00:00",
  "status": "passed",
  "target": "127.0.0.1:10100",
  "testClass": null
}
